paper_id,title,year,architecture,organs,dataset_quality,methodology_quality,evaluation_quality,total_score,quality_rating,main_contribution
http___arxiv.org_abs_2208.13271v1,Efficient Liver Segmentation with 3D CNN Using Computed Tomography Scans,2022,DeepMedic (modified dual-pathway input),liver,8,3,5,18,Medium,An efficient liver segmentation pipeline for abdominal CT that combines liver-focused HU preprocessing and denoising with a dual-pathway 3D DeepMedic model (with CRF refinement) to achieve ~0.93 Dice across three public datasets.
http___arxiv.org_abs_2210.04285v1,Improved Abdominal Multi-Organ Segmentation via 3D Boundary-Constrained Deep Neural Networks,2022,3D U-Net / 3D U-Net++ / 3D Attention U-Net with boundary-constrained multi-task learning (TSOL and TSD variants),"liver, duodenum, stomach, esophagus, spleen, gallbladder, left kidney, pancreas",8,8,7,23,Medium,Introduces a boundary-constrained 3D multi-task learning framework that jointly learns organ masks and organ boundaries to improve abdominal multi-organ CT segmentation across multiple 3D encoder–decoder baselines.
http___arxiv.org_abs_2302.00162v4,"Continual Segment: Towards a Single, Unified and Non-forgetting Continual Segmentation Model of 143 Whole-body Organs in CT Scans",2023,nnU-Net (3D full-resolution) based continual multi-decoder framework,"143 total structures across datasets: 103 TotalSegmentator structures (26 major organs, 59 bones, 10 muscles, 8 vessels; face removed), 31 chest structures (with overlaps: esophagus, trachea, SVC, pulmonary artery), 13 head & neck OARs, and esophagus in advanced cancer domain (EsoOrgan).",8,7,6,21,Medium,"Introduces an architecture-based continual 3D CT multi-organ segmentation framework that scales to 143 organs by freezing a general encoder, adding/pruning task-specific decoders, and merging outputs with body-part and anomaly awareness to avoid catastrophic forgetting."
http___arxiv.org_abs_2302.13172v1,Deep Learning-based Multi-Organ CT Segmentation with Adversarial Data Augmentation,2023,nnU-Net; Token-based Transformer V-Net (TT-Vnet) with AFA-MI augmentation,"BCTV: left kidney, BCTV: right kidney, BCTV: gallbladder, BCTV: liver, BCTV: stomach, BCTV: aorta, BCTV: inferior vena cava, Institutional: heart, Institutional: left kidney, Institutional: right kidney, Institutional: liver, Institutional: left lung, Institutional: right lung, Institutional: spinal cord, Institutional: stomach",5,5,8,18,Medium,"Introduces AFA-MI, an adversarial feature-space data augmentation method for 3D multi-organ CT segmentation that improves accuracy and substantially increases robustness to noise when integrated into nnU-Net and TT-Vnet."
http___arxiv.org_abs_2309.13872v1,Attention and Pooling based Sigmoid Colon Segmentation in 3D CT images,2023,PyP3DUcsSENet (modified 3D U-Net) + ensembles of top-3 models,sigmoid colon,7,4,6,17,Medium,Proposes a modified 3D U-Net with pyramid pooling and csSE attention for sigmoid colon segmentation in 3D CT and shows that ensembling top models substantially improves DSC on MSD colon CT.
